{"module_lock_sha256":"40f0f6f5e6a4ef9015de5109d5d6a6a529281a58f3dde379db4c457f818e3d24","outputs":{"assessment::root-status":"satisfied","basic_terms::selected-terms":[{"penalty_id":"pen:basic","term":{"kind":"term_imprisonment","maximum":{"kind":"specified","value":1},"minimum":{"kind":"not_stated"},"span":{"end":34,"end_col":1,"end_line":2,"start":0,"start_col":1,"start_line":1},"term_id":"term:basic","unit":"days"}}],"choice::selected-penalties":["pen:basic"],"enhanced_terms::selected-terms":null},"plan_id":"fictional.restricted-entry-plan","plan_sha256":"42ef9dedccad13fabf9bef0ee35b92c8fd0f60dded93fc198392af8695b2d1a6","scenario_sha256":"22d9a4fca951fc8f5ce387781dbc299a14061dd4794e9d977677ea27cce43401","schema":"yuho.execution-trace/v0.1","scope":{"authority":"none","court_outcome":"excluded","jurisdiction":"Fictional","review":"none","use":"compiler_fixture"},"step_order":["assessment","choice","basic_terms","enhanced_terms"],"steps":[{"bundle_digest":"f10d94da4d9d1d80550ad689d42c756943bca3be91e9e798e556525b9a4cdf67","gate":{"kind":"unconditional","matched":true},"id":"assessment","outputs":{"root-reason":"satisfied","root-status":"satisfied"},"reason":null,"request_sha256":"cfbff516db80a43f17a6a1d45feae90c735f647b8caf031efb7aeafaf1579bd2","response_sha256":"04675aee11133a9b3f836d27c625c01f9b992fdad1b43c4ccc278ea516330736","state":"completed","variant":"SuppliedProofStatus-v1"},{"bundle_digest":"8afa4d9e87420b0d41048bf7f724b38eba5dedaa66e1ebb887f3d7f44965c4ee","gate":{"kind":"checked","matched":true,"operation":"is","output":"assessment::root-status","value":"satisfied"},"id":"choice","outputs":{"selected-penalties":["pen:basic"],"selection-status":"true"},"reason":null,"request_sha256":"3434f3af3a666f520fb63332387d4615b30afbdc55df39736cbf545aea828e33","response_sha256":"8361d47fcde9fc8908daea28ed67837304d057d7f3da205b85045a05a519b9af","state":"completed","variant":"GuardedPenaltySelection-v1"},{"bundle_digest":"eec2b93247b697f8c5ef62aa5498554caf9d5fbee4d3b62351b459328715323d","gate":{"kind":"checked","matched":true,"operation":"contains","output":"choice::selected-penalties","value":"pen:basic"},"id":"basic_terms","outputs":{"selected-terms":[{"penalty_id":"pen:basic","term":{"kind":"term_imprisonment","maximum":{"kind":"specified","value":1},"minimum":{"kind":"not_stated"},"span":{"end":34,"end_col":1,"end_line":2,"start":0,"start_col":1,"start_line":1},"term_id":"term:basic","unit":"days"}}]},"reason":null,"request_sha256":"991e870cf4cb9d36c013ed0099ab689b135547cdb26382f3bf0a32e855659c3e","response_sha256":"cf45215bfa256e9c5f01b29bbacc16823e475f6429755efc770dfdf8eb62e249","state":"completed","variant":"PenaltyTerms-v1"},{"bundle_digest":"f2215081f1e333f6157f8e45d0c701985850ec41fa4f8682d3aadecfa2af548f","gate":{"kind":"checked","matched":false,"operation":"contains","output":"choice::selected-penalties","value":"pen:enhanced"},"id":"enhanced_terms","outputs":{},"reason":"alternate_candidate_selected","request_sha256":"498705ec76c7368b4dbdf8651ea2306b8826b69d3b7b2d9b3bbae775244a97fd","response_sha256":null,"state":"skipped","variant":"PenaltyTerms-v1"}]}